{
  "schema_version": 1,
  "baseline_id": "BS-P1-001",
  "phase": "PHASE_1",
  "source_repo": "NFF98/appf2-design",
  "source_commit": "259f1e1b2277cf062611108c48112573ddc72cf0",
  "freeze_audit": {
    "status": "PASS",
    "version_lock": true,
    "source_commit": "259f1e1b2277cf062611108c48112573ddc72cf0"
  },
  "projection_engine": {
    "version": "MARKDOWN_EXACT_HEADING_V1",
    "matching": "EXACT_ONLY",
    "fuzzy_matching": false,
    "llm_classification": false
  },
  "entries": [
    {
      "source_path": "working/common-core/ACCEPTANCE-CONVENTIONS.md",
      "source_blob_sha": "39c34174569d5231d08e44397c8384ce03c112c2",
      "mode": "FULL_COPY",
      "target_path": "shared/ACCEPTANCE-CONVENTIONS.md",
      "phase_scope": "PHASE_1_APPLICABLE_TRUTH_ONLY",
      "freeze_audit_verification": "SELF_MARKER",
      "output_sha256": "4d38d92ef68dbd93447c5103c14ce365eeda7510212b2a560dc86287db294521"
    },
    {
      "source_path": "working/common-core/API-CONVENTIONS.md",
      "source_blob_sha": "22ec0960b6fcf63dd4c1ef4d2edf9ccbd35b820d",
      "mode": "FULL_COPY",
      "target_path": "shared/API-CONVENTIONS.md",
      "phase_scope": "PHASE_1_APPLICABLE_TRUTH_ONLY",
      "freeze_audit_verification": "SELF_MARKER",
      "output_sha256": "743eb13b638f8a771ecfa1b9006338ce3238a294427a17bcab0f53e20470f26c"
    },
    {
      "source_path": "working/common-core/EXECUTION-ADMISSION.md",
      "source_blob_sha": "565651fbd569755b0ecdd2919fe4590fbb1ee74a",
      "mode": "FULL_COPY",
      "target_path": "shared/EXECUTION-ADMISSION.md",
      "phase_scope": "PHASE_1_APPLICABLE_TRUTH_ONLY",
      "freeze_audit_verification": "SELF_MARKER",
      "output_sha256": "1968723c3433ed0aa6f036f2ebef4df7bca552a0cc094507efdc31a5864dbf5c"
    },
    {
      "source_path": "working/detailed-design/functions/F00-EXPERIENCE-SHELL.md",
      "source_blob_sha": "0093a9fbd8a7b58eb46e8aeafe66dc07917d5f40",
      "mode": "FULL_COPY",
      "target_path": "functions/F00-EXPERIENCE-SHELL.md",
      "phase_scope": "PHASE_1_APPLICABLE_TRUTH_ONLY",
      "freeze_audit_verification": "SELF_MARKER",
      "output_sha256": "f23d4771caae4a47c0d504e5002dc985570209d41526350051b6a5de9ddf615d"
    },
    {
      "source_path": "working/detailed-design/functions/F01-INTENT-COMPILATION.md",
      "source_blob_sha": "2ff7cc07621ef2f89e720428f482cae9c7ed617b",
      "mode": "FULL_COPY",
      "target_path": "functions/F01-INTENT-COMPILATION.md",
      "phase_scope": "PHASE_1_APPLICABLE_TRUTH_ONLY",
      "freeze_audit_verification": "SELF_MARKER",
      "output_sha256": "2a5695acbc2a526f5e87bbc3016d9598279d4037e5b4dbd25f6a5c276663ef56"
    },
    {
      "source_path": "working/detailed-design/functions/F02-BLUEPRINT-VALIDATION.md",
      "source_blob_sha": "9b4c0444558e73eb57f07709aac742abe3d9dde0",
      "mode": "FULL_COPY",
      "target_path": "functions/F02-BLUEPRINT-VALIDATION.md",
      "phase_scope": "PHASE_1_APPLICABLE_TRUTH_ONLY",
      "freeze_audit_verification": "SELF_MARKER",
      "output_sha256": "b5a4ee2df8c2fff68cfaaa6f9ace93bd89241bf03c2d899718b61c181cd2a92c"
    },
    {
      "source_path": "working/detailed-design/functions/F03-RUNTIME-EXECUTION.md",
      "source_blob_sha": "fa460e80b4e712e3c15161b5023d5d5ba7bb12b7",
      "mode": "FULL_COPY",
      "target_path": "functions/F03-RUNTIME-EXECUTION.md",
      "phase_scope": "PHASE_1_APPLICABLE_TRUTH_ONLY",
      "freeze_audit_verification": "SELF_MARKER",
      "output_sha256": "548f1c616743585fe4ad28e072903a11a4b54437fd2a342ceb97525d34632111"
    },
    {
      "source_path": "working/detailed-design/functions/F04-CAPABILITY-REGISTRY.md",
      "source_blob_sha": "ae6b60cb39ab4b8bef510f29505e056087defe60",
      "mode": "FULL_COPY",
      "target_path": "functions/F04-CAPABILITY-REGISTRY.md",
      "phase_scope": "PHASE_1_APPLICABLE_TRUTH_ONLY",
      "freeze_audit_verification": "SELF_MARKER",
      "output_sha256": "26d95802f63e8c5f9f198d3930fb183d8716dd8f0796aaa7ed58b8a333e7bfeb"
    },
    {
      "source_path": "working/detailed-design/functions/F05-SHARE-RESTORE.md",
      "source_blob_sha": "aaaacfcd5658f68f5e02e5d10f47fafae7f90335",
      "mode": "FULL_COPY",
      "target_path": "functions/F05-SHARE-RESTORE.md",
      "phase_scope": "PHASE_1_APPLICABLE_TRUTH_ONLY",
      "freeze_audit_verification": "SELF_MARKER",
      "output_sha256": "ac0cd6318b98504217be467cabb80286d1ec416ca6ba30af79ff8559dc6518d7"
    },
    {
      "source_path": "working/detailed-design/functions/F06-REMIX-REFINE.md",
      "source_blob_sha": "c9cdf4765dbac17bccfd7975c713b37a6d4b65e4",
      "mode": "FULL_COPY",
      "target_path": "functions/F06-REMIX-REFINE.md",
      "phase_scope": "PHASE_1_APPLICABLE_TRUTH_ONLY",
      "freeze_audit_verification": "SELF_MARKER",
      "output_sha256": "23f747fdab5d6db5c4d7121d11ed7666c9e2c8d7cd342ec3ef636d8d094ab05e"
    },
    {
      "source_path": "working/detailed-design/functions/F07-ANONYMOUS-IDENTITY-EVIDENCE.md",
      "source_blob_sha": "b87720e0dc639a78a0d1532cf09d7007c8b4074d",
      "mode": "FULL_COPY",
      "target_path": "functions/F07-ANONYMOUS-IDENTITY-EVIDENCE.md",
      "phase_scope": "PHASE_1_APPLICABLE_TRUTH_ONLY",
      "freeze_audit_verification": "SELF_MARKER",
      "output_sha256": "f4bcbb553744f94dc158e125130f6cb51695d4728bbda319368f351b6b1d369e"
    },
    {
      "source_path": "working/detailed-design/functions/F12-HUMANIZED-RECOVERY.md",
      "source_blob_sha": "f5ac16f6a7a8e30c76387ede99732f2895ec1915",
      "mode": "FULL_COPY",
      "target_path": "functions/F12-HUMANIZED-RECOVERY.md",
      "phase_scope": "PHASE_1_APPLICABLE_TRUTH_ONLY",
      "freeze_audit_verification": "SELF_MARKER",
      "output_sha256": "9751bcb3feada107660c51a2ad48d1954d29438890e490b4ffad04718d07dbe7"
    },
    {
      "source_path": "working/detailed-design/functions/F16-RESULT-CORRECTION.md",
      "source_blob_sha": "cf70cb2280cd106e0924a9b60f7624fa2ba71d8c",
      "mode": "FULL_COPY",
      "target_path": "functions/F16-RESULT-CORRECTION.md",
      "phase_scope": "PHASE_1_APPLICABLE_TRUTH_ONLY",
      "freeze_audit_verification": "SELF_MARKER",
      "output_sha256": "9749cbd0d6d8300ebd64b0fd0482b05339b5bf6fd6f36fc6105e59f9ec132a58"
    },
    {
      "source_path": "working/detailed-design/UI-UX/DESIGN-SYSTEM.md",
      "source_blob_sha": "e7db16bd23609f5137aa60ad052f5883496b7dea",
      "mode": "FULL_COPY",
      "target_path": "UI-UX/DESIGN-SYSTEM.md",
      "phase_scope": "PHASE_1_APPLICABLE_TRUTH_ONLY",
      "freeze_audit_verification": "SELF_MARKER",
      "output_sha256": "7d6bb65fc6ad73a70b1e45ec5ee7a7891913615e7e6813c244dec1c27c22dcff"
    },
    {
      "source_path": "working/detailed-design/UI-UX/PHASE1-SCREEN-INVENTORY.md",
      "source_blob_sha": "b86fa9e4a058a4d7614aeee9bf71f5792abd6364",
      "mode": "FULL_COPY",
      "target_path": "UI-UX/PHASE1-SCREEN-INVENTORY.md",
      "phase_scope": "PHASE_1_APPLICABLE_TRUTH_ONLY",
      "freeze_audit_verification": "SELF_MARKER",
      "output_sha256": "28e16d716fff3ad441332b4f7b6b0450ebd87056d4798a8ae3b97b05c09a9844"
    },
    {
      "source_path": "working/detailed-design/UI-UX/overlays/O01-SHARE.md",
      "source_blob_sha": "c9ad79256a07885fcdb10918d338e90197325679",
      "mode": "FULL_COPY",
      "target_path": "UI-UX/overlays/O01-SHARE.md",
      "phase_scope": "PHASE_1_APPLICABLE_TRUTH_ONLY",
      "freeze_audit_verification": "SELF_MARKER",
      "output_sha256": "42ac5df713bbd223024bae7f5099c719fc9930d5a7b0b886b7ce401b0d0d2e53"
    },
    {
      "source_path": "working/detailed-design/UI-UX/overlays/O02-CORRECTION-COMPOSER.md",
      "source_blob_sha": "2d4e892f8796b236ed72eb1caca5bf888f205114",
      "mode": "FULL_COPY",
      "target_path": "UI-UX/overlays/O02-CORRECTION-COMPOSER.md",
      "phase_scope": "PHASE_1_APPLICABLE_TRUTH_ONLY",
      "freeze_audit_verification": "SELF_MARKER",
      "output_sha256": "75ae72efdfc7e8ad3629340d44b74d5d20b99bf183f56bbc346cf6563b4f625b"
    },
    {
      "source_path": "working/detailed-design/UI-UX/overlays/O03-RECOVERY.md",
      "source_blob_sha": "2998ab29d745ba0d62f6e509f7fe8104403d29be",
      "mode": "FULL_COPY",
      "target_path": "UI-UX/overlays/O03-RECOVERY.md",
      "phase_scope": "PHASE_1_APPLICABLE_TRUTH_ONLY",
      "freeze_audit_verification": "SELF_MARKER",
      "output_sha256": "1c7528fc7f7eccf9584d9bba7a7b72fdd7fa193a65b7aee860f3fd4322a26bfe"
    },
    {
      "source_path": "working/detailed-design/UI-UX/overlays/O04-REVERT-CONFIRMATION.md",
      "source_blob_sha": "05da66c706d469125b9237a31e149ad480e8ae69",
      "mode": "FULL_COPY",
      "target_path": "UI-UX/overlays/O04-REVERT-CONFIRMATION.md",
      "phase_scope": "PHASE_1_APPLICABLE_TRUTH_ONLY",
      "freeze_audit_verification": "SELF_MARKER",
      "output_sha256": "60910bd308dfd5b18cce6a2917b2b8bbfb48ac1f5e801a6846dcf0a940684d8a"
    },
    {
      "source_path": "working/detailed-design/UI-UX/overlays/O05-LOADING-BUILDING-HYDRATION.md",
      "source_blob_sha": "f8955de23ed541a791dacffaeba570169c5e888d",
      "mode": "FULL_COPY",
      "target_path": "UI-UX/overlays/O05-LOADING-BUILDING-HYDRATION.md",
      "phase_scope": "PHASE_1_APPLICABLE_TRUTH_ONLY",
      "freeze_audit_verification": "SELF_MARKER",
      "output_sha256": "5afd423fc0bcc3053ad0777e883322b44fae2d38ef0be9a901eadebe4b239f45"
    },
    {
      "source_path": "working/detailed-design/UI-UX/screens/S01-DISCOVER-START.md",
      "source_blob_sha": "dd6868b6b83bb4b142662a44124d7203a0f9a0c2",
      "mode": "FULL_COPY",
      "target_path": "UI-UX/screens/S01-DISCOVER-START.md",
      "phase_scope": "PHASE_1_APPLICABLE_TRUTH_ONLY",
      "freeze_audit_verification": "SELF_MARKER",
      "output_sha256": "b563e59c0de623a30ceaca83ae07a56e700597af64cfa53d1d5ce557ca6346ba"
    },
    {
      "source_path": "working/detailed-design/UI-UX/screens/S02-CREATE-WORKSPACE.md",
      "source_blob_sha": "ffff780bad0dd97319c6dcbcbc2e314e9c594b9d",
      "mode": "FULL_COPY",